{
  "capabilities": [
    {
      "acceptanceKinds": [
        "device"
      ],
      "capabilityID": "cap.ai.category",
      "evidence": [
        {
          "path": "apps/android/platform-services/src/main/kotlin/md/vox/android/platformservices/TranscriptEnrichment.kt",
          "symbol": "object DeterministicTranscriptEnrichment"
        },
        {
          "path": "apps/android/app/src/androidTest/kotlin/md/vox/android/LocalIntelligenceInstrumentationTest.kt",
          "symbol": "fun localProcessingProducesChecklistMeetingTitleTagsAndCategoryOutcomes()"
        }
      ],
      "gateIDs": [
        "android-connected-api35",
        "android-local-release"
      ]
    },
    {
      "acceptanceKinds": [
        "device"
      ],
      "capabilityID": "cap.ai.checklist",
      "evidence": [
        {
          "path": "apps/android/capture-domain/src/main/kotlin/md/vox/android/capturedomain/LocalCaptureTextProcessor.kt",
          "symbol": "private fun todoList(source: String)"
        },
        {
          "path": "apps/android/app/src/androidTest/kotlin/md/vox/android/LocalIntelligenceInstrumentationTest.kt",
          "symbol": "fun localProcessingProducesChecklistMeetingTitleTagsAndCategoryOutcomes()"
        }
      ],
      "gateIDs": [
        "android-connected-api35",
        "android-local-release"
      ]
    },
    {
      "acceptanceKinds": [
        "device"
      ],
      "capabilityID": "cap.ai.diarization",
      "evidence": [
        {
          "path": "apps/android/platform-services/src/main/kotlin/md/vox/android/platformservices/SpeakerDiarization.kt",
          "symbol": "object LocalSpeakerDiarizer"
        },
        {
          "path": "apps/android/app/src/androidTest/kotlin/md/vox/android/LocalIntelligenceInstrumentationTest.kt",
          "symbol": "fun localSpeakerDiarizationLabelsGroundedTurnsAndPreservesFallback()"
        }
      ],
      "gateIDs": [
        "android-connected-api35",
        "android-local-release"
      ]
    },
    {
      "acceptanceKinds": [
        "device"
      ],
      "capabilityID": "cap.ai.meeting",
      "evidence": [
        {
          "path": "apps/android/capture-domain/src/main/kotlin/md/vox/android/capturedomain/LocalCaptureTextProcessor.kt",
          "symbol": "private fun meetingNotes(source: String)"
        },
        {
          "path": "apps/android/app/src/androidTest/kotlin/md/vox/android/LocalIntelligenceInstrumentationTest.kt",
          "symbol": "fun localProcessingProducesChecklistMeetingTitleTagsAndCategoryOutcomes()"
        }
      ],
      "gateIDs": [
        "android-connected-api35",
        "android-local-release"
      ]
    },
    {
      "acceptanceKinds": [
        "fixture"
      ],
      "capabilityID": "cap.ai.mode-clean",
      "evidence": [
        {
          "path": "apps/android/capture-domain/src/test/kotlin/md/vox/android/capturedomain/LocalCaptureTextProcessorTest.kt",
          "symbol": "clean applies only to matching scope and preserves original"
        }
      ],
      "gateIDs": [
        "android-local-release"
      ]
    },
    {
      "acceptanceKinds": [
        "fixture"
      ],
      "capabilityID": "cap.ai.mode-custom",
      "evidence": [
        {
          "path": "apps/android/capture-domain/src/test/kotlin/md/vox/android/capturedomain/LocalCaptureTextProcessorTest.kt",
          "symbol": "supported custom instruction performs the requested grounded transformation"
        }
      ],
      "gateIDs": [
        "android-local-release"
      ]
    },
    {
      "acceptanceKinds": [
        "fixture"
      ],
      "capabilityID": "cap.ai.mode-meetingnotes",
      "evidence": [
        {
          "path": "apps/android/capture-domain/src/test/kotlin/md/vox/android/capturedomain/LocalCaptureTextProcessorTest.kt",
          "symbol": "meeting mode creates action section only from matching source fragments"
        }
      ],
      "gateIDs": [
        "android-local-release"
      ]
    },
    {
      "acceptanceKinds": [
        "fixture"
      ],
      "capabilityID": "cap.ai.mode-none",
      "evidence": [
        {
          "path": "apps/android/capture-domain/src/test/kotlin/md/vox/android/capturedomain/LocalCaptureTextProcessorTest.kt",
          "symbol": "none keeps the original deterministic text"
        }
      ],
      "gateIDs": [
        "android-local-release"
      ]
    },
    {
      "acceptanceKinds": [
        "fixture"
      ],
      "capabilityID": "cap.ai.mode-todolist",
      "evidence": [
        {
          "path": "apps/android/capture-domain/src/test/kotlin/md/vox/android/capturedomain/LocalCaptureTextProcessorTest.kt",
          "symbol": "todo mode produces grounded checklist without dropping lines"
        }
      ],
      "gateIDs": [
        "android-local-release"
      ]
    },
    {
      "acceptanceKinds": [
        "device"
      ],
      "capabilityID": "cap.ai.tags",
      "evidence": [
        {
          "path": "apps/android/platform-services/src/main/kotlin/md/vox/android/platformservices/TranscriptEnrichment.kt",
          "symbol": "object DeterministicTranscriptEnrichment"
        },
        {
          "path": "apps/android/app/src/androidTest/kotlin/md/vox/android/LocalIntelligenceInstrumentationTest.kt",
          "symbol": "fun localProcessingProducesChecklistMeetingTitleTagsAndCategoryOutcomes()"
        }
      ],
      "gateIDs": [
        "android-connected-api35",
        "android-local-release"
      ]
    },
    {
      "acceptanceKinds": [
        "device"
      ],
      "capabilityID": "cap.ai.title",
      "evidence": [
        {
          "path": "apps/android/platform-services/src/main/kotlin/md/vox/android/platformservices/TranscriptEnrichment.kt",
          "symbol": "object DeterministicTranscriptEnrichment"
        },
        {
          "path": "apps/android/app/src/androidTest/kotlin/md/vox/android/LocalIntelligenceInstrumentationTest.kt",
          "symbol": "fun localProcessingProducesChecklistMeetingTitleTagsAndCategoryOutcomes()"
        }
      ],
      "gateIDs": [
        "android-connected-api35",
        "android-local-release"
      ]
    },
    {
      "acceptanceKinds": [
        "device"
      ],
      "capabilityID": "cap.billing.reinstall-adjustment",
      "evidence": [
        {
          "path": "apps/android/data/src/main/kotlin/md/vox/android/data/RoomQuotaLedger.kt",
          "symbol": "class RoomQuotaLedger"
        },
        {
          "path": "apps/android/data/src/androidTest/kotlin/md/vox/android/data/ReinstallAdjustmentInstrumentationTest.kt",
          "symbol": "class ReinstallAdjustmentInstrumentationTest"
        },
        {
          "path": "apps/android/scripts/validate-reinstall-quota.py",
          "symbol": "def main()"
        }
      ],
      "gateIDs": [
        "android-connected-api35-reinstall",
        "android-local-release"
      ]
    },
    {
      "acceptanceKinds": [
        "device"
      ],
      "capabilityID": "cap.billing.restore-diagnostics",
      "evidence": [
        {
          "path": "apps/android/app/src/main/kotlin/md/vox/android/PlayBilling.kt",
          "symbol": "data class BillingRestoreDiagnostics"
        },
        {
          "path": "apps/android/app/src/androidTest/kotlin/md/vox/android/BillingRestoreDiagnosticsInstrumentationTest.kt",
          "symbol": "fun restoreDiagnosticsExcludeEveryAccountAndTransactionIdentifier()"
        }
      ],
      "gateIDs": [
        "android-connected-api35",
        "android-local-release"
      ]
    },
    {
      "acceptanceKinds": [
        "fixture"
      ],
      "capabilityID": "cap.delivery.standard",
      "evidence": [
        {
          "path": "apps/android/data/src/androidTest/kotlin/md/vox/android/data/CaptureDatabaseInstrumentationTest.kt",
          "symbol": "failedWriteReservationAndRetryConsumeOnlyAfterVerifiedTerminalCommit"
        }
      ],
      "gateIDs": [
        "android-connected-api36"
      ]
    },
    {
      "acceptanceKinds": [
        "fixture"
      ],
      "capabilityID": "cap.delivery.voice-meter",
      "evidence": [
        {
          "path": "apps/android/capture-domain/src/test/kotlin/md/vox/android/capturedomain/CaptureDeliveryTest.kt",
          "symbol": "recordingDeliveryNeverConsumesTheTextCaptureAllowance"
        },
        {
          "path": "apps/android/data/src/androidTest/kotlin/md/vox/android/data/CaptureDatabaseInstrumentationTest.kt",
          "symbol": "unmeteredRecordingReservationCommitsZeroCaptureUnitsAndRemainsIdempotent"
        }
      ],
      "gateIDs": [
        "android-connected-api36",
        "android-local-release"
      ]
    },
    {
      "acceptanceKinds": [
        "ui"
      ],
      "capabilityID": "cap.editor.add-files",
      "evidence": [
        {
          "path": "apps/android/app/src/main/kotlin/md/vox/android/MainActivity.kt",
          "symbol": "CaptureBarAction.ADD_FILES"
        },
        {
          "path": "apps/android/app/src/androidTest/kotlin/md/vox/android/CaptureBarUiInstrumentationTest.kt",
          "symbol": "fun captureBarMenusAndActionsDispatchEveryEditorCommand()"
        }
      ],
      "gateIDs": [
        "android-connected-api35",
        "android-local-release"
      ]
    },
    {
      "acceptanceKinds": [
        "ui"
      ],
      "capabilityID": "cap.editor.add-media",
      "evidence": [
        {
          "path": "apps/android/app/src/main/kotlin/md/vox/android/MainActivity.kt",
          "symbol": "CaptureBarAction.ADD_MEDIA"
        },
        {
          "path": "apps/android/app/src/androidTest/kotlin/md/vox/android/CaptureBarUiInstrumentationTest.kt",
          "symbol": "fun captureBarMenusAndActionsDispatchEveryEditorCommand()"
        }
      ],
      "gateIDs": [
        "android-connected-api35",
        "android-local-release"
      ]
    },
    {
      "acceptanceKinds": [
        "ui"
      ],
      "capabilityID": "cap.editor.bold",
      "evidence": [